{"user_id": 1, "version": 1760011200000, "size": 300, "generated_at_ms": 1760011200000, "strategy": "personalized", "profile_rebuilt": false, "timings_ms": {"candidates": 16.4, "load_features": 7.7, "ranking": 10.9, "write": 3.1, "total": 38.1}, "candidates": {"total": 587, "author": 150, "category": 120, "similar": 87, "trending": 150, "explore": 80, "ranked": 572}, "filtered": {"missing": 0, "removed": 2, "blocked_author": 0, "seen": 13}}
